{
  "name": "connect-cdc-postgres skill vs docs",
  "skill": "connect-cdc-postgres",
  "description": "Measures whether the connect-cdc-postgres skill adds value over general knowledge and the published Redpanda Connect docs for the postgres_cdc input: table selection, incremental backfills driven by signals, partitioned tables, backfill pacing, and change metadata.",
  "test_cases": [
    {
      "id": "empty-tables-list-scope",
      "query": "I set up a Redpanda Connect postgres_cdc input with schema: billing, tables: [] (empty, because I want every table in billing) and stream_snapshot: true so existing rows get backfilled first. What will this config actually capture?",
      "why": "An empty tables list is accepted: the connector creates its publication FOR ALL TABLES, which replicates every table in every schema and ignores schema, and the initial snapshot is skipped because it is only planned for listed tables. Models guess that the list is required or that schema scopes it.",
      "verified_against": [
        "https://docs.redpanda.com/connect/components/inputs/postgres_cdc/#tables",
        "https://docs.redpanda.com/connect/components/inputs/postgres_cdc/#stream_snapshot",
        "github.com/redpanda-data/connect internal/impl/postgresql/input_pg_stream.go",
        "github.com/redpanda-data/connect internal/impl/postgresql/pglogicalstream/pglogrepl.go"
      ],
      "invariants": [
        {
          "name": "empty_tables_means_all_tables_no_snapshot",
          "failure_condition": "Fails if the answer says the empty list captures only the tables in the billing schema, says the connector rejects an empty tables list at startup (or presents that as a likely outcome in some versions), or says stream_snapshot will backfill existing rows. Passes if it says the publication covers every table in every schema of the database (schema does not limit it) and that no initial snapshot of existing rows is taken; mild hedging is fine."
        }
      ],
      "origin": "docs-cited"
    },
    {
      "id": "partitioned-table-backfill-rejected",
      "query": "I'm using on-demand incremental backfill with the Redpanda Connect postgres_cdc input. When I signal a backfill of my partitioned events table, the connector logs that the request was rejected and the table is left to replication alone. Other tables backfill fine. What do I need to change so the events table can be backfilled?",
      "why": "Incremental snapshots reject partitioned tables unless the connector's publication sets publish_via_partition_root = true, because otherwise changes stream under partition names and cannot be deduplicated against the backfill of the parent. Without the docs, models lead with a missing primary key.",
      "verified_against": [
        "https://docs.redpanda.com/connect/components/inputs/postgres_cdc/#signal_table_name",
        "github.com/redpanda-data/connect internal/impl/postgresql/pglogicalstream/incremental_snapshot.go"
      ],
      "required_patterns": [
        "publish_via_partition_root"
      ],
      "invariants": [
        {
          "name": "partition_root_is_the_cause",
          "failure_condition": "Fails if the answer names a different primary cause (for example a missing primary key on the parent table) as the most likely reason and mentions publish_via_partition_root only as a secondary thing to check. Passes if it identifies the publication lacking publish_via_partition_root = true as the reason the partitioned table is rejected and says to enable it on the publication the connector uses."
        }
      ],
      "origin": "docs-cited"
    },
    {
      "id": "backfill-added-table-without-resnapshot",
      "query": "I added a new table to the tables list of a running Redpanda Connect postgres_cdc pipeline (stream_snapshot: true) and restarted it. New changes to that table come through, but its existing rows never showed up. How can I backfill just that table without dropping the replication slot and re-snapshotting everything?",
      "why": "The incremental snapshot backfills one table on request while streaming continues: it needs a signal table (signal_table_name), a snapshot-execute row naming the table, a checkpoint cache, and stream_snapshot turned off because the two are mutually exclusive. Models suggest external one-off copies instead.",
      "verified_against": [
        "https://docs.redpanda.com/connect/components/inputs/postgres_cdc/#signal_table_name",
        "https://docs.redpanda.com/connect/components/inputs/postgres_cdc/#incremental_snapshot-enabled",
        "github.com/redpanda-data/connect internal/impl/postgresql/config.go"
      ],
      "required_patterns": [
        "snapshot-execute",
        "signal_table_name"
      ],
      "invariants": [
        {
          "name": "stream_snapshot_off_with_incremental",
          "failure_condition": "Fails if the answer keeps stream_snapshot: true while enabling incremental_snapshot, or presents both enabled together as valid. Passes if it sets stream_snapshot to false (or removes it) when enabling incremental_snapshot, or does not combine them."
        }
      ],
      "origin": "docs-cited"
    },
    {
      "id": "rerun-completed-backfill",
      "query": "With the Redpanda Connect postgres_cdc input I already backfilled the orders table once by inserting a snapshot-execute row into my signal table. After a data repair I need to backfill orders again, but inserting another snapshot-execute row just logs that the table is skipped. How do I get it to read the table again?",
      "why": "Backfill progress for the whole run is one checkpoint stored in the checkpoint cache under incremental_snapshot.checkpoint_cache_key; a table that run already covers is skipped and logged, and pointing checkpoint_cache_key at a fresh key (or deleting that one entry) starts a new run so the table can be signalled again. There is no per-table entry to delete and no force option in the signal payload. In the pilot the baseline passed 3/3 under an older, looser grader: it guessed that a cache held a per-table marker 'whose key format I don't know' and listed it beside a fresh signal id, Debezium data-collections and a new slot. The grader now requires the single checkpoint key, so those hedged lists fail.",
      "verified_against": [
        "https://docs.redpanda.com/connect/components/inputs/postgres_cdc/#incremental_snapshot-checkpoint_cache_key",
        "https://docs.redpanda.com/connect/components/inputs/postgres_cdc/#signal_table_name"
      ],
      "invariants": [
        {
          "name": "reset_checkpoint_key",
          "failure_condition": "Fails if the answer relies on a force flag, a new signal id or a different payload shape; if its fix is a workaround outside the incremental snapshot (a separate sql_select pipeline, a new slot or stream_snapshot, no-op updates); or if it only says to look for and delete a per-table marker in the cache without saying the progress lives under incremental_snapshot.checkpoint_cache_key. Passes if it says to point incremental_snapshot.checkpoint_cache_key at a fresh key, or to delete the entry stored under that key, and then signal orders again. Mentioning a rejected option in order to rule it out is fine."
        }
      ],
      "origin": "docs-cited"
    },
    {
      "id": "idle-db-backfill-pacing",
      "query": "I enabled incremental snapshots on the Redpanda Connect postgres_cdc input to backfill a large table in a database that is almost idle. The backfill is crawling: rows seem to arrive in bursts with long gaps in between. What controls the pace and what should I tune?",
      "why": "Each buffered chunk is released on a streamed commit, so on a quiet database the heartbeat paces the backfill; the effective heartbeat is the more frequent of heartbeat_interval and incremental_snapshot.heartbeat_interval, and incremental_snapshot.chunk_size sets rows per release. Models reach for snapshot_batch_size, which only applies to stream_snapshot.",
      "verified_against": [
        "https://docs.redpanda.com/connect/components/inputs/postgres_cdc/#incremental_snapshot-enabled",
        "https://docs.redpanda.com/connect/components/inputs/postgres_cdc/#incremental_snapshot-heartbeat_interval",
        "https://docs.redpanda.com/connect/components/inputs/postgres_cdc/#incremental_snapshot-chunk_size"
      ],
      "required_patterns": [
        "\\bchunk_size\\b"
      ],
      "invariants": [
        {
          "name": "heartbeat_paces_backfill",
          "failure_condition": "Fails if the answer attributes the pace mainly to the output, checkpoint_limit, or snapshot_batch_size, or does not connect the bursts to heartbeats. Passes if it explains that the backfill advances only on streamed commits, so on an idle database each heartbeat releases a chunk, and recommends a shorter incremental_snapshot heartbeat interval (or a more frequent effective heartbeat) and/or a larger chunk size."
        }
      ],
      "origin": "docs-cited"
    },
    {
      "id": "commit-timestamp-metadata",
      "query": "Downstream of a Redpanda Connect postgres_cdc input, I need the time each change was committed in Postgres, not the time Connect processed it. How do I get that in a Bloblang mapping, and will it also be there for the rows read during the initial snapshot?",
      "why": "postgres_cdc sets a commit_ts_ms metadata field (Unix milliseconds) on streamed changes, and it is not set for snapshot reads. The key name is not guessable.",
      "verified_against": [
        "https://docs.redpanda.com/connect/components/inputs/postgres_cdc/#metadata",
        "github.com/redpanda-data/connect internal/impl/postgresql/input_pg_stream.go"
      ],
      "required_patterns": [
        "commit_ts_ms"
      ],
      "invariants": [
        {
          "name": "absent_on_snapshot_rows",